{
  "envelope_version": "0.1",
  "envelope_id": "dti.payment-recovery.native.001",
  "dif": {
    "intent_id": "dif.intent.payment-recovery.native.001",
    "status": "confirmed",
    "summary": "Recover one failed payment attempt without creating an unintended duplicate financial action.",
    "human_confirmed": true
  },
  "di": {
    "feasibility_id": "di.feasibility.payment-recovery.native.001",
    "intent_id": "dif.intent.payment-recovery.native.001",
    "status": "conditional",
    "allowed_paths": [
      "read the authoritative transaction state before another mutation",
      "replay the original operation once through the verified idempotency contract",
      "wait for stronger terminal evidence before another mutation"
    ],
    "blocked_paths": [
      "blind non-idempotent replay while the prior commit state is unresolved"
    ],
    "constraints": [
      "recovery must preserve the identity of the original payment operation",
      "at most one recovery mutation may be attempted for this confirmed intent",
      "no provider-specific adapter, credential, or live payment call is involved"
    ]
  },
  "drp": {
    "record_id": "drp.payment-recovery.native.001",
    "feasibility_id": "di.feasibility.payment-recovery.native.001",
    "decision_summary": "Commit to one bounded idempotent replay of the original operation and prohibit path substitution.",
    "status": "committed"
  },
  "tip": {
    "transition_id": "tip.payment-recovery.native.001",
    "decision_record_id": "drp.payment-recovery.native.001",
    "starting_state": "EXECUTION_FAILED_CONFIRMED",
    "target_state": "TRANSACTION_STATE_ESTABLISHED",
    "action_summary": "Execute the committed idempotent recovery path once and observe the authoritative transaction result.",
    "status": "reviewed"
  },
  "review": {
    "transition_id": "tip.payment-recovery.native.001",
    "status": "reviewed",
    "evidence_references": [
      "evidence://payment-provider/original-operation-id",
      "evidence://payment-provider/terminal-state"
    ],
    "next_state": "RECOVERY_CONFIRMED"
  }
}
