{
  "envelope_version": "0.1",
  "envelope_id": "dti.payment-recovery.001",
  "dif": {
    "intent_id": "dif.intent.payment-exactly-once",
    "status": "confirmed",
    "summary": "Ensure the intended payment reaches one correct terminal outcome without an unintended duplicate financial action.",
    "human_confirmed": true
  },
  "di": {
    "feasibility_id": "di.feasibility.payment-recovery",
    "intent_id": "dif.intent.payment-exactly-once",
    "status": "conditional",
    "allowed_paths": [
      "recover or read the existing transaction state",
      "replay only when the contract provides safe idempotent semantics",
      "wait for stronger evidence when terminality is not established"
    ],
    "blocked_paths": [
      "blindly issue a new non-idempotent payment while prior commit state is unknown"
    ],
    "constraints": [
      "another financial commit may be irreversible",
      "the original commit state is unknown",
      "retry semantics must be known before another create request is safe"
    ]
  },
  "drp": {
    "record_id": "drp.payment-recovery.001",
    "feasibility_id": "di.feasibility.payment-recovery",
    "decision_summary": "Do not issue a new financial commit while the original operation remains ambiguous; recover prior operation state first.",
    "status": "committed"
  },
  "tip": {
    "transition_id": "tip.payment-recovery.001",
    "decision_record_id": "drp.payment-recovery.001",
    "starting_state": "commit_state_unknown",
    "target_state": "established_transaction_state",
    "action_summary": "Perform the contract-defined recovery or read operation before any new financial commit.",
    "status": "committed"
  },
  "review": {
    "transition_id": "tip.payment-recovery.001",
    "status": "pending",
    "evidence_references": [],
    "next_state": "UNOBSERVED"
  }
}
